<?xml version="1.0" encoding="UTF-8"?>
<xs:schema xmlns:xs="http://www.w3.org/2001/XMLSchema" elementFormDefault="qualified"
    targetNamespace="http://www.immunization-portal/citizen"
    xmlns="http://www.immunization-portal/citizen">
    <xs:element name="citizen">
        <xs:complexType>
            <xs:sequence>
                <xs:element name="personal_no" type="xs:string"/>
                <xs:element name="first_name" type="xs:string"/>
                <xs:element name="last_name" type="xs:string"/>
                <xs:element name="date_of_birth" type="xs:date"/>
                <xs:element name="gender">
                    <xs:complexType>
                        <xs:choice>
                            <xs:element name="male"/>
                            <xs:element name="female"/>
                        </xs:choice>
                    </xs:complexType>
                </xs:element>
                <xs:element name="email">
                    <xs:simpleType>
                        <xs:restriction base="xs:string">
                            <xs:pattern value="[A-Za-z0-9._%+-]+@[A-Za-z0-9.-]+\.[A-Za-z]{2,}"/>
                        </xs:restriction>
                    </xs:simpleType>
                </xs:element>
                <xs:element name="residence" type="xs:string"/>
                <xs:element ref="personal_document"/>
            </xs:sequence>
            <xs:attribute name="id" type="xs:string" use="required"/>
        </xs:complexType>
    </xs:element>
    <xs:element name="personal_document">
        <xs:complexType>
            <xs:sequence>
                <xs:element name="type">
                    <xs:simpleType>
                        <xs:restriction base="xs:string">
                            <xs:enumeration value="passaport"/>
                            <xs:enumeration value="identity card"/>
                        </xs:restriction>
                    </xs:simpleType>
                </xs:element>
                <xs:element name="document_no" type="xs:string"/>
                <xs:element name="issued_by" type="xs:string"/>
            </xs:sequence>
        </xs:complexType>
    </xs:element>
</xs:schema>
